{
  "$schema": "https://json-schema.org/draft/2020-12/schema",
  "$id": "se/changes.v1",
  "title": "System Explorer what-changed diff",
  "description": "What changed on one host between a stored snapshot and now (SPEC section 10): added and removed object ids plus changed objects with the dotted paths that differ, per collection, computed by diff-on-read. Changed paths use the evidence-path language, so a change entry cites facts the way an opinion does. Empty diff sections are omitted: a collection with no changes does not appear. Shared $defs are duplicated from observation.schema.json deliberately so each schema file is standalone.",
  "type": "object",
  "required": ["schema", "host", "observed_at", "status"],
  "properties": {
    "schema": { "const": "se.changes/1" },
    "host": { "$ref": "#/$defs/host" },
    "observed_at": { "$ref": "#/$defs/utcTimestamp" },
    "since_requested": {
      "$ref": "#/$defs/utcTimestamp",
      "description": "The request's since parameter resolved to UTC (relative offsets like -24h resolve at request time). Absent when the request omitted since — the baseline is then the oldest stored snapshot by design, not by fallback."
    },
    "baseline": {
      "type": "object",
      "required": ["snapshot_at", "boot_id"],
      "properties": {
        "snapshot_at": { "$ref": "#/$defs/utcTimestamp" },
        "boot_id": { "$ref": "#/$defs/bootId" },
        "fallback": {
          "const": true,
          "description": "Present when nothing stored was as old as since_requested and the oldest snapshot stands in — the diff covers less span than asked for."
        }
      }
    },
    "current_boot_id": { "$ref": "#/$defs/bootId" },
    "rebooted": {
      "type": "boolean",
      "description": "baseline.boot_id differs from current_boot_id: at least one boot boundary lies inside the diff span."
    },
    "status": {
      "enum": ["ok", "partial", "error"],
      "description": "partial when at least one baselined collection failed to collect live (its diff is missing; errors says which). error when no diff was computed at all: history disabled, store empty, or since unparseable."
    },
    "errors": {
      "type": "array",
      "items": { "type": "string", "minLength": 1 }
    },
    "subsystems": {
      "type": "object",
      "description": "Subsystem name -> collection name -> diff. Only subsystems and collections with changes appear; no changes anywhere is an empty object.",
      "propertyNames": { "$ref": "#/$defs/subsystemName" },
      "additionalProperties": {
        "type": "object",
        "propertyNames": { "$ref": "#/$defs/subsystemName" },
        "additionalProperties": { "$ref": "#/$defs/collectionDiff" }
      }
    }
  },
  "allOf": [
    {
      "description": "An error envelope must say what failed; a partial one must say what is missing.",
      "if": { "properties": { "status": { "const": "error" } } },
      "then": { "required": ["errors"] }
    },
    {
      "if": { "properties": { "status": { "const": "partial" } } },
      "then": { "required": ["errors"] }
    },
    {
      "description": "A computed diff carries its baseline and boot identity.",
      "if": { "properties": { "status": { "enum": ["ok", "partial"] } } },
      "then": { "required": ["baseline", "current_boot_id", "rebooted", "subsystems"] }
    }
  ],
  "$defs": {
    "host": {
      "type": "object",
      "required": ["machine_id", "hostname"],
      "properties": {
        "machine_id": { "type": "string", "pattern": "^[0-9a-f]{32}$" },
        "hostname": { "type": "string", "minLength": 1 }
      }
    },
    "subsystemName": {
      "type": "string",
      "pattern": "^[a-z][a-z0-9-]*$"
    },
    "objectId": {
      "type": "string",
      "pattern": "^[a-z][a-z0-9-]*:\\S+$"
    },
    "bootId": {
      "type": "string",
      "minLength": 1,
      "description": "/proc/sys/kernel/random/boot_id with dashes stripped (the system adapter's rendering); the literal 'unknown' when unreadable."
    },
    "collectionDiff": {
      "type": "object",
      "minProperties": 1,
      "properties": {
        "added": {
          "type": "array",
          "minItems": 1,
          "items": { "$ref": "#/$defs/objectId" }
        },
        "removed": {
          "type": "array",
          "minItems": 1,
          "items": { "$ref": "#/$defs/objectId" }
        },
        "changed": {
          "type": "array",
          "minItems": 1,
          "items": {
            "type": "object",
            "required": ["id", "paths"],
            "properties": {
              "id": { "$ref": "#/$defs/objectId" },
              "paths": {
                "type": "array",
                "minItems": 1,
                "items": { "type": "string", "minLength": 1 },
                "description": "Dotted paths within the item summary that differ (facts.ActiveState, worst_opinion_level) — the same path language opinions cite evidence with."
              }
            }
          }
        }
      }
    },
    "utcTimestamp": {
      "type": "string",
      "pattern": "^\\d{4}-\\d{2}-\\d{2}T\\d{2}:\\d{2}:\\d{2}(\\.\\d+)?Z$"
    }
  }
}
